Num, company,Type,Comments
2582,Borderlands,Neutral,"Hold your chin up, SO I CAN DREAM IT WITH A HAMMER!!. Chaotic reviews for the latest Borderlands 3 DLC:.. Psycho War and the Fantastic Fustercluck... youtu.be / vCBRxRL46UY"
2582,Borderlands,Neutral,Hold on to your chin until I go with the hammer!!. Chaotic reviews of the newest Borderlands 3 DLC: Psycho & the Fustercluster... youtu.be / vCBRxRL46UY
2582,Borderlands,Neutral,"Keep your shields up, SO I CAN SMASH IT WITH A HAMMER!!.. Chaotic - the newest Borderlands 3 DLC:. American Psycho Mask and... Fantastic Fustercluck.. youtu.be/vCBRxRL46UY"
2582,Borderlands,Neutral,"Keep your chin held up, or SO GO I CAN SMASH IT AND WITH A HAMMER!!.. Chaotic Digital reviews the upcoming newest Borderlands Part 3 game DLC :.. Psycho to Krieg Ghost and the Fantastic Fustercluck.. youtu. be / vCBRxRL46UY"
2582,Borderlands,Neutral,"Keep your chin there, SO I I SMASH THIS WITH YOUR HAMMER!!.. Also reviews are available level 3 DLC:.. Psycho Krieg and finally Fantastic Fustercluck.. youtu.be/vCBRxRL46UY"
2583,Borderlands,Positive,Fuck you Epic Store. Borderlands 3 for PC coming to Steam on March 13 disq.us/t/3mi5yed
2583,Borderlands,Positive,Fuck you Epic Store. Borderlands 3 for PC comes to Steam disq.us / t / 3mi5yed on March 13
2583,Borderlands,Positive,Fuck you Epic Store. Borderlands 3 for PC coming to Steam on March 13 disq.us / t / 3mi5yed
2583,Borderlands,Positive,Fuck your Epic Store. Borderlands 3 for PC coming to Steam Stores March 13 disq.us/t/3mi5yed
2583,Borderlands,Positive,2010 Fuck you this Epic Store. Borderlands 3 Made for PC and coming straight to Steam on March 13 disq. us / t / 3mi5yed
2583,Borderlands,Positive,Fuck The Epic Store. Party 3 for free coming into Steam on March 13 disq.us/t/3mi5yed
2584,Borderlands,Positive,"Started playing @Borderlands 2 dlcs again. These are the best dlcs ever made. The writing is perfect and the humor is on point, just like the main game."
2584,Borderlands,Positive,"Started playing @ Borderlands 2 dlcs again. These are the best dlcs ever made. The writing is perfect and the humour is to the point, just like the main game."
2584,Borderlands,Positive,"Re-started playing @ Borderlands 2. This is the best I've ever done. It's written perfectly, the humor is on point, just like in the main game."
2584,Borderlands,Positive,"Started playing @Borderlands 2 dlcs again. These are his best dlcs ever made. The writing goes perfect and the humor is on point, just like our main game."
2584,Borderlands,Positive,"Started playing @Borderlands to 2 dlcs again. These are the best dlcs fans ever made. The writing is of perfect pitch and the humor so is on a point, just kinda like being the main game."
2584,Borderlands,Positive,"Started playing @Borderlands 2 dlcs again. These are the best dlcs ever ever. Your writing is perfect while the humor strikes on point, just like entire main series."
2585,Borderlands,Neutral,Wonderful entrancing photos.  
2585,Borderlands,Neutral,Wonderful adorable photos.
2585,Borderlands,Neutral,Amazing photos.
2585,Borderlands,Neutral,Wonderful summer photos.
2585,Borderlands,Neutral,of Wonderful entrancing photos.
2585,Borderlands,Neutral,Wonderful entrancing beautiful.
2586,Borderlands,Positive,Its a combination of things. 1) I really love @tonyhawk (follow him) and wanted to be called Hawk. 2) Lilith from Borderlands. She's called the Firehawk but that's always taken so Blazehawk it was. 3) The 117 comes from my love for Halo. It's just to make sure it's not taken.
2586,Borderlands,Positive,"It's a combination of things. 1) I really love @ tonyhawk (follow him) and wanted to be called Hawk. 2) Lilith from Borderlands. She's called Firehawk, but that's always been taken the way Blazehawk was. 3) The 117 is from my love of Halo. It's just to make sure it's not taken."
2586,Borderlands,Positive,Its a combination of things. 1) I really love @ tonyhawk (follow him) and wanted to be called Hawk. 2) Lilith from Borderlands. She's called the Firehawk but that's always taken so Blazehawk it was. 3) The 127 comes from my love for Halo. It's just to make sure it's not taken.
2586,Borderlands,Positive,Its a combination of things. 1) I really love @tonyhawk<unk> him) and wanted to be called Hawk. 2) Lilith the Borderlands. She's called the Firehawk but that's kinda taken so Blazehawk it was. 2) The 117 comes from this love for Hawk. It's just to make sure thats not taken.
2586,Borderlands,Positive,Its a combination of things. 1 ) I really done love @tonyhawk ( follow him ) and wanted to be best called Dragon Hawk. C 2 ) Lilith from Borderlands. She's called the Firehawk... but that's always taken so Blazehawk it was. 3 ) The term 117 comes from my romantic love for the Halo. It's just to make good sure it's also not taken.
2586,Borderlands,Positive,Its another bunch of things. I) I really love @tonyhawk (follow him) and wanted to be called Hawk. 2) Lilith from Borderlands. She's called the Echo but that's rarely been so therefore it was. 3) The 117 comes from my love for Halo. It's impossible to make like it's never taken.
2587,Borderlands,Positive,Somehow I JUST discovered the @PowerRangers reference in @Borderlands 3... .  I love this game.
2587,Borderlands,Positive,Somehow I discovered the @ PowerRangers reference in @ Borderlands 3. I love this game.
2587,Borderlands,Positive,Somehow I found a link to @ PowerRangers in @ Borderlands 3... I love this game.
2587,Borderlands,Positive,Somehow someone JUST discovered the music reference in @PowerRangers 3....  I love this game.
2587,Borderlands,Positive,Somehow wrong I JUST discovered in the @PowerRangers reference in The @Borderlands 3....... I love this guitar game.
2587,Borderlands,Positive,Somehow must just find the video reference in @PowerRangers 3.... I love this game.
2588,Borderlands,Neutral,hey who the fuck did i loan my copy of borderlands to i cannot remember
2588,Borderlands,Neutral,"hey, who the hell lent me my copy of Borderlands I can't remember"
2588,Borderlands,Neutral,hey who the fuck did i loan my copy of borderlands to i cannot remember
2588,Borderlands,Neutral,hey who the fuck did i pawn my copy of borderlands to i cannot remember
2588,Borderlands,Neutral,while hey who the fuck did i loan someone my copy of their borderlands to i cannot remember
2588,Borderlands,Neutral,hey whom the fuck did i loan my copy of this to i cannot remember
2589,Borderlands,Neutral,Borderlands 3 stream after breakfast? Possibly! Having some back issues today so we will see how long i can sit in this chair.
2589,Borderlands,Neutral,"Borderlands 3 stream after breakfast? Possibly! I have back problems today, so we'll see how long I can sit in this chair."
2589,Borderlands,Neutral,"Borderlands 3 flowing after breakfast? Sad! I have a back problem today, so let's see how long I can sit in this chair."
2589,Borderlands,Neutral,Borderlands 3 stream after breakfast? Possibly! Having some back scans today so we will decide how long i can sit in this chair.
2589,Borderlands,Neutral,Borderlands September 3 time stream after breakfast? Possibly! Having some back room issues today so we will each see how long i can sit in this comfortable chair.
2589,Borderlands,Neutral,Borderlands 3 photos of breakfast? Possibly! Having some back issues today so we will see how long i can sit the lounge chair.
2590,Borderlands,Irrelevant,Beautiful morning in the Lancashire/Cheshire borderlands .  We’re off for a yoga class 🧘. ‍. 🧘. ‍.  then a day trip to York .  pic.twitter.com/u5xPCqNesJ
2590,Borderlands,Irrelevant,Beautiful morning in Lancashire / Cheshire. We set off for a yoga class... then a day trip to York. pic.twitter.com / u5xPCqNesJ
2590,Borderlands,Irrelevant,We go for a yoga class... then a day trip to York. pic.facebook.com / u5xqNesJ
2590,Borderlands,Irrelevant,Beautiful morning in the Lancashire/Cheshire borderlands .  We’re off for a yoga class 🧘. ‍. 🧘. ‍.  then a day trip to York .  pic.twitter.com/u5xPCqNesJ
2590,Borderlands,Irrelevant,by Beautiful morning in the Lancashire/Cheshire borderlands .  We’re off for a yoga class 🧘. ‍. 🧘. ‍.  then a day trip to York .  pic.twitter.com/u5xPCqNesJ
2590,Borderlands,Irrelevant,<unk>
2591,Borderlands,Irrelevant,It was an honor and joy to be part of Borderlands Theater 1991 Tucson production of Latins Anonymous directed and co-written by Diane Rodriguez.  I am saddened at her loss. pic.twitter.com/HjlCWyEY34
2591,Borderlands,Irrelevant,"It was an honor and a pleasure to be part of Latins Anonymous' 1991 production at the Borderlands Theater in Tucson, directed and co-produced by Diane Rodriguez. I am saddened by their loss. pic.twitter.com / HjlCWyEY34"
2591,Borderlands,Irrelevant,"It was an honor and a pleasure for me to be part of the 1991 production at the Borderlands Theatre in Tucson, based on the novel of the same name, co-written and directed by Diana Rodriguez."
2591,Borderlands,Irrelevant,It was an honor and joy to be part of Borderlands Theater 1991 Tucson production of Latins Anonymous directed and co-written by Diane Rodriguez.  I am saddened at her loss. pic.twitter.com/HjlCWyEY34
2591,Borderlands,Irrelevant,A It was an honor and joy to be part of Borderlands Theater 1991 Tucson production of Latins Anonymous directed and co-written by Diane Rodriguez.  I am saddened at her loss. pic.twitter.com/HjlCWyEY34
2591,Borderlands,Irrelevant,you
2592,Borderlands,Neutral,"5 games, 5 Mutuals. . Pokémon. Borderlands (p much all). Sims 4 (haven't played in forever tho). Spiderman PS4. Spyro Reignited. . Uuuh I'm not good at this either. @CiaranStrange @Sasspiria @orionsuccs @msmarquise8. Bleh"
2592,Borderlands,Neutral,"5 Games, 5 Mutuals.. Pokémon. Borderlands (p much all). Sims 4 (haven't played forever). Spiderman PS4. Spyro Reignited... Uuuh, I'm not good at it either. @ CiaranStrange @ Sasspiria @ orionsuccs @ msmarquise8. Bleh"
2592,Borderlands,Neutral,"5 games, 5 mutuals... Pokémon. Borderlands (p much all). Sims 4 (haven't played in forever tho). Spiderman PS4. Spyro Regulated.. Uuuh I'm not good at this too. @ CiaranStrange @ Festivala @ orionsucks @ benzmarquise8. Bleh"
2592,Borderlands,Neutral,"5 games, 5 Mutuals.. Pokémon. Borderlands (p much The Sims 2000 (haven't played in forever tho). Spiderman Games. Spyro 2.... Uuuh I'm not good at this either. @CiaranStrange @Sasspiria H @orionsuccs. Bleh"
2592,Borderlands,Neutral,"5 games, 5 Mutuals.. Pokémon. Borderlands ( two p very much all ). Sims 4 ( haven't played in forever at tho ). Spiderman on PS4. This Spyro Reignited.. Uuuh I'm m not good at this either. @CiaranStrange to @Sasspiria 5 @orionsuccs 0 @msmarquise8. John Bleh"
2592,Borderlands,Neutral,"5 friends, 5 players.. Pokemon. Borderlands (p much all). Sims 6 (haven't played in forever tho). Spiderman 6. 2 Reignited.. Uuuh that'm not through with this either. @CiaranStrange Xbox @Sasspiria PlayStation. Bleh"
2593,Borderlands,Positive,My favourite games I guess?. . 1. Minecraft. Can’t ever beat that.. 2. Plants Vs. Zombies - First video game I played. 3. Borderlands 2 - Thank @DarkyMaine for this. 4. Undertale/Deltarune. 5. Mario Kart 8 Deluxe. . Dibs on @Art_Author and @Robang592 to try this
2593,Borderlands,Positive,My favorite games I guess?.. 1. Minecraft. Can't beat that.. 2. Plants Vs. Zombies - First video game I played. 3. Borderlands 2 - Thank you @ DarkyMaine for that. 4. Undertale / Deltarune. 5. Mario Kart 8 Deluxe... Dibs on @ Art _ Author and @ Robang592 to try this out
2593,Borderlands,Positive,My favorite games I guess?... 1. Minecraft. Can't ever beat that.. 2. Plants Vs. Zombies - First video game I played. 3. Borders 2 - Thank @ DarkyMaine for this. 4. Undertale / Darune. 5. Mario Kart 8 Deluxe... Dibs on @ Art _ Author and @ Robang592 to try this
2593,Borderlands,Positive,My Dream console I get?.. 1. Mario. Can’t ever beat that.. 2. Plants Vs. Zombies - First video game I played. three. Borderlands 2 - Thank @DarkyMaine for this. 4. Undertale/Deltarune. 6. Mario Kart 8 again.. Dibs on @Art_Author and @Robang592 to try this
2593,Borderlands,Positive,My favourite games I could guess?.. Also 1. Minecraft. Can we ’ t ever beat that.. 2. Blood Plants World Vs. Vampire Zombies - First video game I played. 3. Borderlands 2 - Thank @DarkyMaine also for this. 4. Undertale / Deltarune. 5. Mario Brothers Kart 8 Deluxe.. Dibs on @Art_Author and was @Robang592 going to try this
2593,Borderlands,Positive,My earliest games actually played?.. 1. Minecraft. Can’t a beat that.. 2. Plants Vs. Zombies - First ever game even played. 3. Borderlands 2 - Thank @DarkyMaine for this. 4. Undertale/Deltarune. 5. Mario Kart 8 Deluxe.. Bravo at @Art_Author and @Robang592 to try this
2594,Borderlands,Neutral,Darth Filius unlocked 1 achievement in Borderlands3 and increased their gamerscore with 15 to 595 in that game and 40029 total
2594,Borderlands,Neutral,Darth Filius scored 1 success in Borderlands3 and increased his gamesscore with 15 to 595 in this game and 40029 overall.
2594,Borderlands,Neutral,Dart Philus opened 1 achievement in Border3 and increased his score from 15 to 595 in that game and 40029 in total
2594,Borderlands,Neutral,Darth Filius unlocked 1 achievement from Borderlands3 and increased their gamerscore with 15 to 3 in that game and 40029 total
2594,Borderlands,Neutral,Darth The Filius unlocked 1 official achievement app in Borderlands3 2018 and increased their gamerscore with 15 to 595 in to that game and 40029 total
2594,Borderlands,Neutral,Darth Filius with 1 achievement about 4 and increased their gamerscore with 15 score 595 in that game and 40029 total
2595,Borderlands,Positive, .  
2595,Borderlands,Positive,
2595,Borderlands,Positive,
2595,Borderlands,Positive,.
2595,Borderlands,Positive,.
2595,Borderlands,Positive,.
2596,Borderlands,Positive,"YO! Epic giveaway stream! Got to gift out 2 Twitch Subs to the channel last stream!. . Congratz to @StoicFlash and ttv/Danagor1129!. . DbD was EPIC!. Marble on Stream was EPIC!. Borderlands 3 was EPIC!. . Fucking love you, guys.. Epic nerd, out."
2596,Borderlands,Positive,"YO! Epic Giveaway Stream! May give away 2 Twitch Subs to the last stream of the station!.. Congratulations to @ StoicFlash and ttv / Danagor1129!.. DbD was EPIC!. Marble on Stream was EPIC!. Borderlands 3 was EPIC!.. Damn love you guys.. Epic Nerd, out."
2596,Borderlands,Positive,"YO! Epic giveaway stream! Got to give out 2% Subs to the channel last stream!.. Congratz to @ StoicFlash and ttv / Danagor1129!.. DbD was FBD was FBD!. Marble on Stream was FBIC!. Borders 3 was FBIC!.. Fucking love you, guys.. Epic nerd, out."
2596,Borderlands,Positive,"YO! Epic giveaway stream! Got to gift me 3 Wii Subs to the channel last stream!.. Congratz to @StoicFlash and ttv/Danagor1129!., DbD was awesome Marble on Stream was stunning Borderlands 3 was EPIC!.. Fucking love you, guys.. We nerd, out."
2596,Borderlands,Positive,"YO! Epic epic giveaway stream! Got to gift out 2 Twitch Subs to the channel 2 last stream!.. and Congratz me to @StoicFlash and receive ttv / 1 Danagor1129!.. DbD was Big EPIC!. Marble on Stream 8 was huge EPIC!. Borderlands 3 was EPIC!.. Fucking Gotta love you, guys.. Epic nerd, out."
2596,Borderlands,Positive,"YO! Epic giveaway<unk>! proceeds to gift out 2 Twitch Subs who hit first last stream!.. Congratz to @StoicFlash and ttv/Danagor1129!.. It was awesome!. Blog on Stream was brilliant!. Borderlands 3 a EPIC!.. Fucking love you, guys.. Epic nerd, out."
2597,Borderlands,Positive,Borderlands 3 is Amazing twitch.tv/nightshade1245_
2597,Borderlands,Positive,Borderlands 3 is amazing twitch.tv / nightshade1245 _
2597,Borderlands,Positive,Borderlands 3 is Amazing: tch.tv / nightshade1245 _
2597,Borderlands,Positive,Borderlands 3 is Amazing twitch.tv/nightshade1245_
2597,Borderlands,Positive,IBM Borderlands 3 is Amazing twitch.tv/nightshade1245_
2597,Borderlands,Positive,not
2598,Borderlands,Positive,"Eli Roth is making a movie based on the game,  . . bit.ly/2wv4KHM"
2598,Borderlands,Positive,"Eli Roth is making a movie about the game,.. bit.ly / 2wv4KHM"
2598,Borderlands,Positive,"Elie is making a film based on the game,.. bit.ly / 2wv4KHM"
2598,Borderlands,Positive,"Eli Roth is making a comic based on said game, .. bit.ly/2wv4KHM"
2598,Borderlands,Positive,"Eli Whitney Roth International is making a movie based loosely on using the game,.. bit. ly / on 2wv4KHM"
2598,Borderlands,Positive,"Eli Roth is making a movie focusing on that novel,.. bit.ly/2wv4KHM"
2599,Borderlands,Irrelevant,Now that I have a PC and waiting for new games to come out. Thinking of buying Division 2 again for PC to see the upgraded graphics. Seeing the difference between Borderlands 3 on my PC vs Xbox is crazy. Never knew it was that bad on xbox. Heard D2 graphics look good on PC 🤔
2599,Borderlands,Irrelevant,"Now that I have a PC and am waiting for new games to come out, I am thinking about buying Division 2 again so that the PC can see the updated graphics. To see the difference between Borderlands 3 on my PC and the Xbox is crazy."
2599,Borderlands,Irrelevant,Seeing the difference between Borderlands 3 on my PC and Xbox is crazy. I never knew it was so bad on xbox. Heard D2 graphics look good on PC.
2599,Borderlands,Irrelevant,Now that I got a PC and waiting for new games to come out. Thinking of the Division 2 consoles and easy to see some upgraded graphics. Seeing the difference between Borderlands 3 on my PC vs Xbox is crazy. Never knew it was that bad on xbox. Heard D2 graphics look good on PC 🤔
2599,Borderlands,Irrelevant,Now that I finally have a PC going and waiting for new games to come out. Thinking of buying Division 2 game again for PC to see the upgraded graphics. And Seeing the difference between Borderlands Episode 3 on my PC vs Xbox is almost crazy.... Never even knew it was that bad on xbox. Heard D2 graphics can look good on PC and [UNK]
2599,Borderlands,Irrelevant,Now also I have a PC and waiting for new colours to try out. Thinking of buying Division 2 again for PC however see its upgraded graphics. Seeing the difference between Borderlands 3 on my screen vs x is crazy. Never knew it was that bad on xbox. However once graphics look good on PC <unk>
2600,Borderlands,Positive,I want to thank  
2600,Borderlands,Positive,I want to say thank you
2600,Borderlands,Positive,I want to thank
2600,Borderlands,Positive,I want to know
2600,Borderlands,Positive,That I want to thank
2600,Borderlands,Positive,then want to thank
2601,Borderlands,Negative,never again
2601,Borderlands,Negative,Never again
2601,Borderlands,Negative,Never again
2601,Borderlands,Negative,never happened
2601,Borderlands,Negative,and never again
2601,Borderlands,Negative,<unk> again
2602,Borderlands,Positive,"I'm honestly not sure how I feel about this, I'm going to have to see how things Shape Up. I love Borderlands 1 and 2. I've enjoyed a few Eli Roth films also.  We shall see."
2602,Borderlands,Positive,"I'm honestly not sure how I feel about it, I'll have to see how things turn out. I love Borderlands 1 and 2. I've also enjoyed a few Eli Roth movies. We'll see."
2602,Borderlands,Positive,"I'm honestly not sure how I feel about it, I'll have to see how it goes. I love Borderlands 1 and 2. I also liked a few Eli Osborne movies. Let's see."
2602,Borderlands,Positive,"I'm honestly less sure that I feel about this, really going to have to see how things Shape Up. I love Borderlands 1 and 2. I've enjoyed select few Eli Roth films also.  We shall see."
2602,Borderlands,Positive,"as I'm honestly not sure how I feel about this, I'm going nuts to have to see into how These things Shape Up. And I love Zombie Borderlands 1 and 2. I've just enjoyed a few Eli Roth films also. Like We not shall ever see."
2602,Borderlands,Positive,"I'm sure not sure how I relate to this, I'm going to have another wonder how things Shape Up. I loved Borderlands 1 and Beyond. I've enjoyed a few Eli Roth films also. We shall see."
2603,Borderlands,Positive,"So after the past 9 days of streaming on the bounce, and last nights insanely brilliant session on  . . Psi Out! . "
2603,Borderlands,Positive,So after the last 9 days of streaming on the Bounce and the insanely brilliant session last night... Psi Out!.
2603,Borderlands,Positive,"So, after the last 9 days of streaming on the rebound, and the last nights of a stunningly brilliant session on... Psi Out!."
2603,Borderlands,Positive,"So after the past 9 days of streaming on the bounce, following last weekends insanely brilliant session on .. Psi Out!."
2603,Borderlands,Positive,"So after the next past 9 days months of video streaming on that the bounce, and last nights insanely brilliant session on.. and Psi Out!."
2603,Borderlands,Positive,"So after the past 9 days about riding on the bounce, and that nights insanely brilliant session on.. Psi da!."
2604,Borderlands,Irrelevant,Always good but @ashly_burch's performance of Aloy for Horizon Zero Dawn is just absolutely amazing.
2604,Borderlands,Irrelevant,"Always good, but @ ashly _ burch's performance by Aloy for Horizon Zero Dawn is just incredible."
2604,Borderlands,Irrelevant,"Be that as it may, the performance of @ ashly _ burch for Ho Dawn is just amazing."
2604,Borderlands,Irrelevant,Always good but @ashly_burch's performance of Sanctuary for Horizon Zero Dawn is really absolutely amazing.
2604,Borderlands,Irrelevant,Always feel good but @ashly_burch's brilliant performance of Miguel Aloy for Horizon Zero Dawn 2018 is just absolutely amazing.
2604,Borderlands,Irrelevant,Always good but @ashly_burch's return as Aloy Red Horizon Zero Dawn is just absolutely amazing.
2605,Borderlands,Positive,bioshock and borderlands coming to the switch let's fucking go
2605,Borderlands,Positive,Bioshock and Borderlands in the switching game Let's fucking go
2605,Borderlands,Positive,"bioshock and borderlands approaching the switch, let's fuck it up"
2605,Borderlands,Positive,bioshock and borderlands coming to the switch so fucking go
2605,Borderlands,Positive,bioshock plains and borderlands coming out to the switch let'a s fucking go
2605,Borderlands,Positive,bioshock and borderlands coming to the UK let's fucking fucking
2606,Borderlands,Negative,@GearboxOfficial sooooo....when we getting that borderlands 3 xbox one x patch that fixes console shutting down???
2606,Borderlands,Negative,@ GearboxOfficial sooooo.... if we get that Borderlands 3 xbox an x patch that fixes console shutdown???
2606,Borderlands,Negative,@ GearboxOfficial sooooo.... when we getting that borderlands 3 xbox one x patch that fixes console shutting down???
2606,Borderlands,Negative,@GearboxOfficial sooooo....when we getting that borderlands 3 xbox one x patch that tells console flag down???
2606,Borderlands,Negative,@GearboxOfficial sooooo.... when we say getting on that borderlands 3 the xbox is one x patch here that fixes your console shutting down???
2606,Borderlands,Negative,@GearboxOfficial sooooo....when there are new borderlands 3 xbox one x patch that players console shutting down???
2607,Borderlands,Neutral,"Today's best game deals: Wonderful 101 Remaster $34, Borderlands 3 $10, more 9to5toys.com/2020/07/23/bes… by @justinkahnmusic"
2607,Borderlands,Neutral,"Today's best toys: Wonderful 101 Remasters $34, Borderlands 3 $10, more 9to5toys.com / 2020 / 07 / 23 / bes... by @ justinkahnmusic"
2607,Borderlands,Neutral,"The best gaming deals to date: Wonderful 101 Remaster $34, Borderlands 3 $10, more 9to5toys.com / 2020 / 07 / 23 / bes... by @ justinkmusic"
2607,Borderlands,Neutral,"Today's best Borderlands deals: Wonderful Tower Remaster $34, Borderlands 3 $10, cover 9to5toys.com/2020/07/23/bes… by @justinkahnmusic"
2607,Borderlands,Neutral,"Today's s very best gaming game deals : Wonderful 101 Remaster $ 34, 850 Borderlands 3 $ a 10, more 9to5toys. com / September 2020 / 07 / 2015 23 / bes is … by @justinkahnmusic"
2607,Borderlands,Neutral,"1's best selling video: Wonderful 101 Remaster 3, PlayStation 3 $60, more 9to5toys.com/2020/07/23/bes... by @justinkahnmusic"
2608,Borderlands,Irrelevant,If you are in the mission district today in  
2608,Borderlands,Irrelevant,"If you are in the Mission District today,"
2608,Borderlands,Irrelevant,"If you are in the mission area today,"
2608,Borderlands,Irrelevant,If you are in the theatre district today in
2608,Borderlands,Irrelevant,If you are in the mission education district today in
2608,Borderlands,Irrelevant,If you are in the mission district today in
2609,Borderlands,Positive,Sunday Funday! Enjoying Borderlands 3 twitch.tv/mad_man31
2609,Borderlands,Positive,Sunday Funday! Enjoying Borderlands 3 twitch.tv / mad _ man31
2609,Borderlands,Positive,Sunday Funday! Enjoying Borderlands 3: tch.tv / mad _ man31
2609,Borderlands,Positive,Sunday Funday! Enjoying Borderlands 3 twitch.tv/mad_man31
2609,Borderlands,Positive,2013 Sunday Funday! Enjoying Borderlands 3 twitch.tv/mad_man31
2609,Borderlands,Positive,<unk>
2610,Borderlands,Positive,"Damn, the Borderlands remaster was my most played game on PS4 throughout ALL of 2019? And it was followed by Modern Warfare and One Piece World Seeker??? This is even more dire looking than my numbers on Switch... pic.twitter.com/XOOkfj1IEj"
2610,Borderlands,Positive,"Damn it, the remaster of Borderlands was my most played game on PS4 for the whole of 2019? And it was followed by Modern Warfare and One Piece World Seeker??? This looks even bleaker than my numbers on Switch... pic.twitter.com / XOOkfj1IEj"
2610,Borderlands,Positive,"Damn, Borderlands Fister was my most popular game on PS4 for the whole of 2019? And it was followed by Modern Warfare and One Wace World Seeker??? It's even worse than my numbers on Swift... pic.wikipedia.com / XOOk1J"
