Num, company,Type,Comments
1796,CallOfDutyBlackopsColdWar,Irrelevant,Sun: Rocking. -. - Co-stream @ emgoood? LIVE. 10 / 4... - twitch.tv / MNKOGaming.... @ Pulse _ Rts @ SpideyRTs @ BlazedRTs @ TwitchSIE @ SGH _ RTs @ stream _ boost @ tools _ by _ ezio @ rtsmallstreams
1796,CallOfDutyBlackopsColdWar,Irrelevant,Sun: Rocking. - Co-stream @ emgoood? LIVE. 10 / 4... - Hetch.tv / MNKOGaming...... @ Pulse _ Rts @ Spideys @ Blazeds @ HetchSIE @ SS _ s @ stream _ boost @ tools _ by _ e @ rtsmallstreams
1796,CallOfDutyBlackopsColdWar,Irrelevant,Sun: Rocking  . -  . - Co-stream RhandlerR?  LIVE . 10/4. . .  - twitch.tv/MNKOGaming. .  . RhandlerR RhandlerR RhandlerR RhandlerR RhandlerR RhandlerR RhandlerR RhandlerR
1796,CallOfDutyBlackopsColdWar,Irrelevant,UK Sun: Rocking  . -  . - Co-stream RhandlerR?  LIVE . 10/4. . .  - twitch.tv/MNKOGaming. .  . RhandlerR RhandlerR RhandlerR RhandlerR RhandlerR RhandlerR RhandlerR RhandlerR
1796,CallOfDutyBlackopsColdWar,Irrelevant,Why
1797,CallOfDutyBlackopsColdWar,Irrelevant,LETS FUCKING GOOOOOOOOOOOOOOOOOOOOOOOOOOOOOOOOOOOOOOOOOOOOOOOOOOOOOOOOOOOOOOOOOOOOOOOOOOOOOOOOOOOOOOOOOOOOOOO
1797,CallOfDutyBlackopsColdWar,Irrelevant,OOOOOOOOOOOOOOOOOOOOOOOOOOOOOOOOOOOOOOOOOOOOOOOOOOOOOOOOOOOOOOOOOOOOOOOOOOOOOOOOOOOOOOOOOOOOOOOOOOOOOOOOOOOOOOOOOOOOOOOOOOOOOOOOOOOOOOOOOOOOOOOOOOOOOOOOOOOOOOOOOOOOOOOOOOOOOOOOOOOOOOOOOOOOOOOOOOOOOO
1797,CallOfDutyBlackopsColdWar,Irrelevant,LETS FUCKING GOOOOOOOOOOOOOOOOOOOOOOOOOOOOOOOOOOOOOOOOOOOOOOOOOOOOOOOOOOOOOOOOOOOOOOOOOOOOOOO
1797,CallOfDutyBlackopsColdWar,Irrelevant,LETS IS GOOOOOOOOOOOOOOOOOOOOOOOOOOOOOOOOOOOOOOOOOOOOOOOOOOOOOOOOOOOOOOOOOOOOOOOOOOOOOOOOOOOOOOOOOOOOOOO
1797,CallOfDutyBlackopsColdWar,Irrelevant,NO LETS IN FUCKING that GOOOOOOOOOOOOOOOOOOOOOOOOOOOOOOOOOOOOOOOOOOOOOOOOOOOOOOOOOOOOOOOOOOOOOOOOOOOOOOOOOOOOOOOOOOOOOOO
1797,CallOfDutyBlackopsColdWar,Irrelevant,LETS A GOOOOOOOOOOOOOOOOOOOOOOOOOOOOOOOOOOOOOOOOOOOOOOOOOOOOOOOOOOOOOOOOOOOOOOOOOOOOOOOOOOOOOOOOOOOOOOO
1798,CallOfDutyBlackopsColdWar,Negative,Cod Black Ops Cold War. Sorry but the mechanics on the game are really shite. It feels like I’m playing a really old game.. 🤣. 🤦. ‍. 
1798,CallOfDutyBlackopsColdWar,Negative,"Cod Black Ops Cold War. Sorry, but the mechanics of the game is really crazy. It feels like I'm playing a really old game."
1798,CallOfDutyBlackopsColdWar,Negative,"Black Ops Cold War cod. Sorry, but the mechanics of the game are really sewn up. It feels like I'm playing a really old game."
1798,CallOfDutyBlackopsColdWar,Negative,Cod Black Ops Cold War. Sorry but the mechanics on This game are really shite. It feels like a playing a wicked old game.. 🤣. Like. ‍.
1798,CallOfDutyBlackopsColdWar,Negative,Cod Black Ops Cold War. 2013 Sorry but the mechanics on play the game are really pretty shite. It feels like I will ’ 3 m playing myself a really old game.. The [UNK]. [UNK]..
1798,CallOfDutyBlackopsColdWar,Negative,Cod Evil Ops Cold Case. Sorry but the mechanics on the game are really stupid. It seemed like people playing a really old time.. <unk>. <unk>..
1799,CallOfDutyBlackopsColdWar,Positive,So many  
1799,CallOfDutyBlackopsColdWar,Positive,
1799,CallOfDutyBlackopsColdWar,Positive,So much
1799,CallOfDutyBlackopsColdWar,Positive,So …
1799,CallOfDutyBlackopsColdWar,Positive,So far many
1799,CallOfDutyBlackopsColdWar,Positive,So What
1800,CallOfDutyBlackopsColdWar,Neutral,"""Movement speeds are better than ever"" yet the death animations are exactly the same and Treyarch yet again stay away from ragdoll animations.. .  "
1800,CallOfDutyBlackopsColdWar,Neutral,"""The movement speeds are better than ever,"" but the death animations are exactly the same and Treyarch once again keeps away from ragdoll animations..."
1800,CallOfDutyBlackopsColdWar,Neutral,"""Speed is better than ever,"" however, the death animation is exactly the same, and Treyarch once again steer clear of ragdoll animation..."
1800,CallOfDutyBlackopsColdWar,Neutral,"""Movement speeds are better than ever"" yet the death animations look exactly the same and they yet again stay<unk> from ragdoll animations..."
1800,CallOfDutyBlackopsColdWar,Neutral,""" Movement through speeds are better than speeds ever "" yet the death animations are exactly the actual same and Treyarch artists yet again cannot stay away from using ragdoll animations..."
1800,CallOfDutyBlackopsColdWar,Neutral,"""Movement speeds are better than ever"" yet some death statistics are exactly the same and Treyarch yet others stay secluded from ragdoll toys..."
1801,CallOfDutyBlackopsColdWar,Negative,It literally just looks like all those shitty richtofen edits people have been  making
1801,CallOfDutyBlackopsColdWar,Negative,It literally looks like all these shitty straightening furnace edits were made by people
1801,CallOfDutyBlackopsColdWar,Negative,"Literally, it seems like all these crap things that people do."
1801,CallOfDutyBlackopsColdWar,Negative,It literally just looks like all those shitty richtofen edits people always been  making
1801,CallOfDutyBlackopsColdWar,Negative,It all literally just looks something like all those shitty richtofen edits people have already been making
1801,CallOfDutyBlackopsColdWar,Negative,It literally just looks out all with shitty richtofen edits people have been making
1802,CallOfDutyBlackopsColdWar,Positive,IM. HYPED. HOLY SHIT
1802,CallOfDutyBlackopsColdWar,Positive,IM. HYPED. HOLY SHOTS
1802,CallOfDutyBlackopsColdWar,Positive,HIPED. HOLI SHIT
1802,CallOfDutyBlackopsColdWar,Positive,IM. HYPED. To SHIT
1802,CallOfDutyBlackopsColdWar,Positive,TO IM. HYPED. HOLY I SHIT
1802,CallOfDutyBlackopsColdWar,Positive,IM. HYPED. HOLY J
1803,CallOfDutyBlackopsColdWar,Positive,Woods in Call of Duty: Black Ops Cold War has such a nice beard!
1803,CallOfDutyBlackopsColdWar,Positive,Woods in Call of Duty: Black Ops Cold War has such a nice beard!
1803,CallOfDutyBlackopsColdWar,Positive,Woods in Call of Duty: Black Ops Cold War has such a nice beard!
1803,CallOfDutyBlackopsColdWar,Positive,Woods in Call of Duty: Black Ops Cold War has grown a nice beard!
1803,CallOfDutyBlackopsColdWar,Positive,James Woods in Call of Duty : Black metal Ops Cold War has become such a nice beard!
1803,CallOfDutyBlackopsColdWar,Positive,Woods in Call of Duty: Black Planet 2: War has such a nice beard!
1804,CallOfDutyBlackopsColdWar,Positive,"BLACK OPS COLD WAR OFFICIAL REVEAL! (New Trailer Thoughts) youtu.be/5YgBjhf96zY via @YouTube I can’t wait bro! Love the video, getting me hype .  @RealThunder402"
1804,CallOfDutyBlackopsColdWar,Positive,BLACK OPS COLD WAS OFFICIAL REVEAL! (New Trailer Thoughts) youtu.be / 5YgBjhf96zY via @ YouTube I can't wait bro! I love the video and get a hype. @ RealThunder402
1804,CallOfDutyBlackopsColdWar,Positive,"BLACK OPS COLD WAR OFFICIAL REVEAL! (New Trailer Thoughts) youtu.be / 5YgBj96zY via @ YouTube I can't wait bro! Love the video, getting me h. @ RealThunder402"
1804,CallOfDutyBlackopsColdWar,Positive,"BLACK OPS COLD WAR OFFICIAL RELEASE! (+ Trailer Available) youtu.be/5YgBjhf96zY via YouTube I can’t wait forever! Love the video, getting me hype.  @YouTube"
1804,CallOfDutyBlackopsColdWar,Positive,"BLACK OPS COLD WAR YOU OFFICIAL REVEAL! ( Brand New Trailer Thoughts ) youtu. May be / 5YgBjhf96zY via @YouTube And I really can just ’ t wait for bro! Love with the video, getting on me many hype. @RealThunder402"
1804,CallOfDutyBlackopsColdWar,Positive,"BLACK AND COLD WAR OFFICIAL TO! (New User Thoughts) youtu.be/5YgBjhf96zY 2 @YouTube I can’t relax bro! watch that video, want more hype. @RealThunder402"
1805,CallOfDutyBlackopsColdWar,Negative,OH MY GODDD . 
1805,CallOfDutyBlackopsColdWar,Negative,OH MY GOD.
1805,CallOfDutyBlackopsColdWar,Negative,Oh MY GOD.
1805,CallOfDutyBlackopsColdWar,Negative,OH MY!.
1805,CallOfDutyBlackopsColdWar,Negative,Just OH MY GODDD.
1805,CallOfDutyBlackopsColdWar,Negative,OH MY LORD.
1806,CallOfDutyBlackopsColdWar,Negative,@CallofDuty @ATVIAssist apparently for some I cant seem to play   
1806,CallOfDutyBlackopsColdWar,Negative,@ CallofDuty @ ATVIAssist apparently for some I can't seem to play
1806,CallOfDutyBlackopsColdWar,Negative,@ CfDuty @ ATVIAssist apparently for someone I can't seem to play with
1806,CallOfDutyBlackopsColdWar,Negative,@CallofDuty @ATVIAssist apparently for some purpose cant seem to play
1806,CallOfDutyBlackopsColdWar,Negative,As @CallofDuty @ATVIAssist apparently for some I cant seem up to really play
1806,CallOfDutyBlackopsColdWar,Negative,@CallofDuty @ATVIAssist apparently for some I cant do a play
1807,CallOfDutyBlackopsColdWar,Irrelevant,Perfection...!. 
1807,CallOfDutyBlackopsColdWar,Irrelevant,Perfection...!.
1807,CallOfDutyBlackopsColdWar,Irrelevant,Perfect...!.
1807,CallOfDutyBlackopsColdWar,Irrelevant,Perfection...!.
1807,CallOfDutyBlackopsColdWar,Irrelevant,With Perfection...!.
1807,CallOfDutyBlackopsColdWar,Irrelevant,a...!.
1808,CallOfDutyBlackopsColdWar,Neutral,"Uhhhhhhhh YUP destiny has competition for atleast a few months when this comes out.. . Idc what any of y'all think, first 2 black ops were amazing and I'll pick this one up for sure."
1808,CallOfDutyBlackopsColdWar,Neutral,"Uhhhhhhhh YUP fate has competition for at least a couple of months when this comes out... Idc what everyone thinks, the first two Black Ops were fantastic and I will certainly pick this up here."
1808,CallOfDutyBlackopsColdWar,Neutral,"Uhhhhhhhh YUP destination has competition for at least a few months when this comes out... Idc what any of y'all think, first 2 black ops were amazing and I'll pick this one up for sure."
1808,CallOfDutyBlackopsColdWar,Neutral,"Uhhhhhhhh YUP This has competition for atleast a few months but this comes out... not what any of y'all thinking, first 2 black ops were amazing and I'll pick this one up for sure."
1808,CallOfDutyBlackopsColdWar,Neutral,"Uhhhhhhhh... YUP you destiny has competition for atleast information a quick few months back when this comes out... Idc what any of y'most all think, first 2 black ops units were amazing and I'll sure pick this one on up here for sure."
1808,CallOfDutyBlackopsColdWar,Neutral,"Uhhhhhhhh because destiny gets competition for atleast a few episodes when this comes along... Idc what some of y'all said, first 2 black ops always amazing and I'll pick this one up for 2."
1809,CallOfDutyBlackopsColdWar,Neutral,Ok. Fuck it. I might actually get it lol . . Call of Duty Black Ops: Cold War - Official Teaser Trailer youtu.be/m1kfCGjOaSw via @YouTube
1809,CallOfDutyBlackopsColdWar,Neutral,Ok. Fuck it. I could actually get it lol.. Call of Duty Black Ops: Cold War - Official Teaser Trailer youtu.be / m1kfCGjOaSw via @ YouTube
1809,CallOfDutyBlackopsColdWar,Neutral,Ok. Fuck it. I might actually get it lol.. Call of Duty Black Ops: Cold War - Official Teaser Trailer youtu.be / m1kfCGjOaSw via @ YouTube
1809,CallOfDutyBlackopsColdWar,Neutral,Ok. Fuck it. I might go get it as.. Call of Duty Black Ops: Cold War - Official Official Trailer br.be/m1kfCGjOaSw via @YouTube
1809,CallOfDutyBlackopsColdWar,Neutral,Because Ok. Fuck it. And I still might even actually get above it now lol.. Call of Active Duty Black Cross Ops : Cold War - Official Teaser Trailer youtu. And be / m1kfCGjOaSw go via @YouTube
1809,CallOfDutyBlackopsColdWar,Neutral,mm. Fuck it. Oh do actually get it lol.. Main<unk> Duty Black Ops: World War - Official YouTube Trailer youtu.be/m1kfCGjOaSw via @YouTube
1810,CallOfDutyBlackopsColdWar,Irrelevant,Seriously bro what the FUCK have y’all been doing @Xbox
1810,CallOfDutyBlackopsColdWar,Irrelevant,Seriously bro what the FUCK y'all have done @ Xbox
1810,CallOfDutyBlackopsColdWar,Irrelevant,Bro what FUCK did all along @ Xbox
1810,CallOfDutyBlackopsColdWar,Irrelevant,Seriously bro what the FUCK have y’all been doing<unk>
1810,CallOfDutyBlackopsColdWar,Irrelevant,Seriously you bro what the damned FUCK have y ’ all u been doing @Xbox
1810,CallOfDutyBlackopsColdWar,Irrelevant,Seriously bro what in FUCK do y’all been doing in
1811,CallOfDutyBlackopsColdWar,Positive,I wish Call of Duty Black Ops Cold War was coming out November 3rd instead. Cant wait
1811,CallOfDutyBlackopsColdWar,Positive,I wish Call of Duty Black Ops Cold War would come out on November 3 instead.
1811,CallOfDutyBlackopsColdWar,Positive,I'd like Call of Duty Black Ops The Cold War to be released on November 3 instead.
1811,CallOfDutyBlackopsColdWar,Positive,I wish Call of Duty Black Ops Cold War is coming out November 3rd instead. Cant wait
1811,CallOfDutyBlackopsColdWar,Positive,I almost wish Call of Duty Black Ops Cold Air War was coming out next November 3rd instead. YOU Cant wait
1811,CallOfDutyBlackopsColdWar,Positive,I wish Call of Duty Un Ops Cold War kept coming this November 3rd instead. Cant wait
1812,CallOfDutyBlackopsColdWar,Positive,I guess I should watch this since I am playing it tonight . 
1812,CallOfDutyBlackopsColdWar,Positive,I think I should watch it because I'm playing it tonight.
1812,CallOfDutyBlackopsColdWar,Positive,I think I should watch it as I play it tonight.
1812,CallOfDutyBlackopsColdWar,Positive,I guess I should watch this since I am streaming it tonight.
1812,CallOfDutyBlackopsColdWar,Positive,I guess I should watch after this since I guess am playing it tonight.
1812,CallOfDutyBlackopsColdWar,Positive,I guess I should tell this why I am playing it tonight.
1813,CallOfDutyBlackopsColdWar,Irrelevant,Ws in the chat . 
1813,CallOfDutyBlackopsColdWar,Irrelevant,Ws in the chat.
1813,CallOfDutyBlackopsColdWar,Irrelevant,Ws in the chat.
1813,CallOfDutyBlackopsColdWar,Irrelevant,Ws from the chat.
1813,CallOfDutyBlackopsColdWar,Irrelevant,Ws in by the chat.
1813,CallOfDutyBlackopsColdWar,Irrelevant,Ws in the world.
1814,CallOfDutyBlackopsColdWar,Irrelevant,Yesssir 🤩‼. 
1814,CallOfDutyBlackopsColdWar,Irrelevant,Yesssir.
1814,CallOfDutyBlackopsColdWar,Irrelevant,Yesser.
1814,CallOfDutyBlackopsColdWar,Irrelevant,Yesssir ka.
1814,CallOfDutyBlackopsColdWar,Irrelevant,Yesssir David [UNK] [UNK].
1814,CallOfDutyBlackopsColdWar,Irrelevant,<unk> <unk>!!.
1815,CallOfDutyBlackopsColdWar,Irrelevant,Pubs are actually fun for the first time in years. Music and Vibes today.   
1815,CallOfDutyBlackopsColdWar,Irrelevant,"For the first time in years, pubs are really fun. Music and vibes today."
1815,CallOfDutyBlackopsColdWar,Irrelevant,Music and vibrations today are really fun for the first time in many years.
1815,CallOfDutyBlackopsColdWar,Irrelevant,Pubs are actually open for the first time in years. Music and Vibes today.
1815,CallOfDutyBlackopsColdWar,Irrelevant,Pubs are becoming actually fun for the now first time in years. Music and Vibes work today.
1815,CallOfDutyBlackopsColdWar,Irrelevant,Pubs are actually moving for the first time in years. Music from Vibes today.
1816,CallOfDutyBlackopsColdWar,Positive,Hooray for zombies  
1816,CallOfDutyBlackopsColdWar,Positive,Hooray for zombies
1816,CallOfDutyBlackopsColdWar,Positive,Hooray for the Zombies
1816,CallOfDutyBlackopsColdWar,Positive,Hooray - zombies
1816,CallOfDutyBlackopsColdWar,Positive,Hooray for killing zombies
1816,CallOfDutyBlackopsColdWar,Positive,Hooray no zombies
1817,CallOfDutyBlackopsColdWar,Positive,I made a crazy Cod Black Ops Cold War montage. I put a lot of effort into it and I’m sure you’ll love it🥺 youtu.be/XuIUNh1Sqbw
1817,CallOfDutyBlackopsColdWar,Positive,"I made a crazy montage of Cold War cod black ops that I put a lot of effort into, and I'm sure you'll love it youtu.be / XuIUNh1Sqbw."
1817,CallOfDutyBlackopsColdWar,Positive,I made a crazy Cod Black Ops Cold War montage. I put a lot effort into it and I'm sure you'll love it youtu.be / XuIUNh1Sqbw
1817,CallOfDutyBlackopsColdWar,Positive,I made a new Cod Black Ops Dead Room montage. I put a lot of effort towards it and I’m sure you’ll agree it🥺 youtu.be/XuIUNh1Sqbw
1817,CallOfDutyBlackopsColdWar,Positive,I made for a crazy Cod Black Ops Cold Nations War montage. I put a lot of effort really into it and I wrote ’ 4 m sure that you miss ’ u ll love [UNK] youtu. TO be / XuIUNh1Sqbw
1817,CallOfDutyBlackopsColdWar,Positive,<unk> not a crazy Heavy Black or Cold War montage. I put a lot more care into everything and I’m sure you’ll love it<unk> youtu.be/XuIUNh1Sqbw
1818,CallOfDutyBlackopsColdWar,Positive,Only upped my FOV by 10 and can definitely feel the hit on my FPS. Have to bear in mind that the PS5 is going to be a different animal to my PS4. Loving the maps and the movement though. It's going to be lit when it's finished. . .  
1818,CallOfDutyBlackopsColdWar,Positive,"I just increased my FOV by 10 and I definitely feel the impact on my FPS. You have to remember that the PS5 will be a different animal than my PS4. Nevertheless, I love the cards and the movement. It will light up when it is ready..."
1818,CallOfDutyBlackopsColdWar,Positive,Only upped my FOV by 10 and can definitely feel the hit on my FPS. Have to bear in mind that the PS5 is going to be a different animal to my PS4. Loving the maps and the movement though. It's going to be light when it's finished.....
1818,CallOfDutyBlackopsColdWar,Positive,Only beats my FPS by 10 and can definitely feel the hit at my FPS. Have to bear in mind that the PS5 is going to be totally different animal to my liking. Loving the maps and the movement though. It's going to be lit when it's finished.. more
1818,CallOfDutyBlackopsColdWar,Positive,Well Only a upped my FOV by 10 mm and which can definitely feel the hit on my FPS. Have to bear in mind too that presumably the PS5 is going just to be a different animal to my PS4. Loving the maps better and the movement though. It'l s going to be lit red when it's finished...
1818,CallOfDutyBlackopsColdWar,Positive,I upped my FOV by 10 so can definitely feel the hit on my PSP. Have to have in mind that now PS5 is going to be a different animal to my PS4. Loving the maps that the movement though. Still's good to be lit when it's wanting...
1819,CallOfDutyBlackopsColdWar,Positive,Guys.. I'm fucking HYPED for  
1819,CallOfDutyBlackopsColdWar,Positive,Guys.. I'm fucking HYPIERED for
1819,CallOfDutyBlackopsColdWar,Positive,Guys.. I'm fucking HYPED for
1819,CallOfDutyBlackopsColdWar,Positive,Guys.. I'm fucking HYPED now
1819,CallOfDutyBlackopsColdWar,Positive,Guys.. I'm m really fucking HYPED for
1819,CallOfDutyBlackopsColdWar,Positive,Guys.. I'm fucking HYPED with
1820,CallOfDutyBlackopsColdWar,Positive,This looks amazing! Have high hopes for this.. considering how shite the recent mw/warzone is. .   
1820,CallOfDutyBlackopsColdWar,Positive,This looks amazing! Have high hopes of this. considering how shite is the youngest mw / warzone.
1820,CallOfDutyBlackopsColdWar,Positive,It looks amazing! Have high hopes for this.. given how bad the recent mw / warzone is...
1820,CallOfDutyBlackopsColdWar,Positive,This looks amazing! Have massive hopes for Andromeda considering how shite the recent mw/warzone is..
1820,CallOfDutyBlackopsColdWar,Positive,... This still looks amazing! Have high national hopes only for this.. considering how awful shite the recent mw / warzone is..
1820,CallOfDutyBlackopsColdWar,Positive,This looks good! Have high regard for this.. the just shite the recent mw/warzone is..
1821,CallOfDutyBlackopsColdWar,Irrelevant,So
1821,CallOfDutyBlackopsColdWar,Irrelevant,So it is not surprising that the EU Commission has taken a number of measures in recent years to improve the situation in Ukraine.
1821,CallOfDutyBlackopsColdWar,Irrelevant,So
1821,CallOfDutyBlackopsColdWar,Irrelevant,So
1821,CallOfDutyBlackopsColdWar,Irrelevant,I So
1821,CallOfDutyBlackopsColdWar,Irrelevant,in
1822,CallOfDutyBlackopsColdWar,Neutral,Today's the day that early access to Black Ops Cold War beta on PS4 starts. Too bad I don't have a code. Sucks being broke. Have fun whoever is able to play. https://t.co/jXUcYjatSE
1822,CallOfDutyBlackopsColdWar,Neutral,Today is the day when early access to the beta of Black Ops Cold War on the PS4 begins. Too bad I have no code. Sucks broken. Have fun whoever is able to game. https: / / t.co / jXUcYjatSE
1822,CallOfDutyBlackopsColdWar,Neutral,Today's the day that early access to Black Ops Cold War beta on PS4 starts. Too bad I don't have a code. Sucks being broken. Have fun ever is able to play. https: / / Fenco / jXUCYjatSE
1822,CallOfDutyBlackopsColdWar,Neutral,Today's the day that early access to Black Ops Deep War beta on PS4 starts. Too late to don't find a code. Sucks being broke. Have fun whoever is able to play. https://t.co/jXUcYjatSE]
1822,CallOfDutyBlackopsColdWar,Neutral,Today's the day that early desktop access to Black Ice Ops Cold War beta on PS4 starts. Too bad that I totally don't actually have a code. Sucks being broke. ″ Have extra fun whoever nobody is able to play. Will https://t.co/jXUcYjatSE ]
1822,CallOfDutyBlackopsColdWar,Neutral,Microsoft's massive announcement that public access to High Ops Cold Spring beta on PS4 starts. Too bad I don't have a code. Sucks being broke. Have fun whoever is able to do. https://t.co/jXUcYjatSE]
1823,CallOfDutyBlackopsColdWar,Irrelevant,Yeeeee hell ya
1823,CallOfDutyBlackopsColdWar,Irrelevant,Jaaaaaaaaaaaaaaaaaaaaaaaaaaaaaaaaaaaaaaaaaaaaaaaaaaaaaaaaaaaaaaaaaaaaaaa
1823,CallOfDutyBlackopsColdWar,Irrelevant,Ееееееееееееееееееееееееееееееееееееееееееееееееееееееееееееееееееееееееееееееееееееееееееееееееееееееееееееееееееееееееееееееееееееееееееееееееееееееееееееееееееееееееееееееееееееееееееееееееееееее
1823,CallOfDutyBlackopsColdWar,Irrelevant,Yeeeee hell<unk>
1823,CallOfDutyBlackopsColdWar,Irrelevant,The Yeeeee hell ya
1823,CallOfDutyBlackopsColdWar,Irrelevant,Yeeeee what ya
1824,CallOfDutyBlackopsColdWar,Positive,sniping actually looks good i’m surprised 🥺
1824,CallOfDutyBlackopsColdWar,Positive,"Sniper actually looks good, I'm surprised"
1824,CallOfDutyBlackopsColdWar,Positive,"sniping actually looks good, I'm surprised"
1824,CallOfDutyBlackopsColdWar,Positive,sniping actually looks awkward i’m surprised 🥺
1824,CallOfDutyBlackopsColdWar,Positive,sniping actually never looks good i still ’ m surprised [UNK]
1824,CallOfDutyBlackopsColdWar,Positive,sniping actually looked cute i’m surprised <unk>
1825,CallOfDutyBlackopsColdWar,Negative,Fuck. This.
1825,CallOfDutyBlackopsColdWar,Negative,Shit.
1825,CallOfDutyBlackopsColdWar,Negative,Fuck. This.
1825,CallOfDutyBlackopsColdWar,Negative,Fuck. That.
1825,CallOfDutyBlackopsColdWar,Negative,... Fuck. This.
1825,CallOfDutyBlackopsColdWar,Negative,Fuck.<unk>.
1826,CallOfDutyBlackopsColdWar,Positive,So I played the Black Ops Cold War Alpha last weekend and wanted to share some thoughts on @YouTube . . I'm not happy with what I played!. . youtu.be/lfyudVRmQDU. .  
1826,CallOfDutyBlackopsColdWar,Positive,So last weekend I played the Black Ops Cold War Alpha and wanted to share some thoughts on @ YouTube.. I'm not happy with what I played!.. youtu.be / lfyudVRmQDU..
1826,CallOfDutyBlackopsColdWar,Positive,So I played Black Ops Cold War last weekend and wanted to share some thoughts on @ YouTube... I'm not happy with what I played!.. youtu.be / lfyudVRmQDU...
1826,CallOfDutyBlackopsColdWar,Positive,So I played Marvel Black Ops Cold War Alpha last weekend and wanted to share some perspective on them.. I'm not happy with what I played!. of youtu.be/lfyudVRmQDU..
1826,CallOfDutyBlackopsColdWar,Positive,So I recently played the Black Ops in Cold War Alpha last weekend before and immediately wanted to share in some fresh thoughts on @YouTube.. I'am m not but happy anymore with what part I played!.. youtu. be / lfyudVRmQDU..
1826,CallOfDutyBlackopsColdWar,Positive,So he played the Black Ops on Zero Alpha last night and decided to share some feelings on @YouTube.. I'm extremely happy with what he played!.. youtu.be/lfyudVRmQDU..
1827,CallOfDutyBlackopsColdWar,Positive,What’s your favorite class? 🤔 . . Call of Duty: Black Ops Cold War | This Is Now The Best Class Ever! buff.ly/3dSaOMk. .  
1827,CallOfDutyBlackopsColdWar,Positive,What is your favorite class?... Call of Duty: Black Ops Cold War | This Is Now The Best Class Ever! buff.ly / 3dSaOMk..
1827,CallOfDutyBlackopsColdWar,Positive,What's your favorite class?.. Call of Duty: Black Ops Cold War... This is Now The Best Class Ever! buff.ly / 3dSaOMk..
1827,CallOfDutyBlackopsColdWar,Positive,What’s your favorite class?!.. Call of Call: Black Ops Cold Cube | This Is Now The Best Class Ever! buff.ly/3dSaOMk. gif
1827,CallOfDutyBlackopsColdWar,Positive,So What ’ ya s really your favorite class? [UNK].. Call of Honor Duty : Black Ops Cold War | If This Is Now As The Best Class... Ever! buff. info ly / 3dSaOMk..
1827,CallOfDutyBlackopsColdWar,Positive,What’s his favorite class? <unk>.. Call<unk> Duty: Black Death Cold Base | This Feeling Like The Best Class Ever! buff.ly/3dSaOMk..
1828,CallOfDutyBlackopsColdWar,Irrelevant,Such a throw backkkkkkk. 31/1 literally hate how trash I am now but just wait lol  
1828,CallOfDutyBlackopsColdWar,Irrelevant,"Such a litter backkkkkkk. 31 / 1 literally hate how rubbish I am now, but just wait lol"
1828,CallOfDutyBlackopsColdWar,Irrelevant,"Such a throw backkkkkkk. 31 / 1 I literally hate how trash I am right now, but I'm just waiting for lol"
1828,CallOfDutyBlackopsColdWar,Irrelevant,Such a look backkkkkkk. 31/1 literally hate how trash this am now but just wait lol
1828,CallOfDutyBlackopsColdWar,Irrelevant,Such a throw backkkkkkk. 31 / page 1 I literally hate how trash and I am now you but now just wait lol
1828,CallOfDutyBlackopsColdWar,Irrelevant,Such a throw backkkkkkk. 31/1 100% hate my trash I am saying but just wait lol
1829,CallOfDutyBlackopsColdWar,Negative,tell em bout that broken slide!!!
1829,CallOfDutyBlackopsColdWar,Negative,Tell em battle that broken slide!!!
1829,CallOfDutyBlackopsColdWar,Negative,Tell them that the slide has broken!!!
