Num, company,Type,Comments
2756,Borderlands,Positive,"I'm .. Twitch.tv/thecolorabi.. I also have a new overlay, color and BRB screens of @gr_tesque made and I perfected my photoshop magic tonight!"
2756,Borderlands,Positive,"Tomorrow I'm.. Twitch. to tv / thecolorabi.. I also have designed a brand new overlay, start and finish BRB screens that my @gr_tesque made daily and I worked my photoshop magic up on!"
2756,Borderlands,Positive,"and'm.. finishing.tv/thecolorabi.. I also have a different overlay, start and break screens that @gr_tesque made and I need an photoshop up on!"
2757,Borderlands,Negative,@Borderlands @GearboxOfficial @DuvalMagic @ProdigyXL . This doesn’t look right. At all. Why am I just noticing this now? Shouldn’t the payouts be better in M4? Or are these typos. pic.twitter.com/ZyFAPOihPy
2757,Borderlands,Negative,@ Borderlands @ GearboxOfficial @ DuvalMagic @ ProdigyXL. That doesn't look right. At all. Why am I noticing this right now? Shouldn't the payouts in M4 be better? Or is it typos. pic.twitter.com / ZyFAPOihPy
2757,Borderlands,Negative,@ Borderlands @ GearboxOfficial @ DuvalMagic @ ProdigyOfficial.
2757,Borderlands,Negative,RhandlerR RhandlerR RhandlerR RhandlerR . This doesn’t look right. At all. Why am I just noticing this now? Shouldn’t the payouts be better in M4? Or are these typos. pic.twitter.com/ZyFAPOihPy
2757,Borderlands,Negative,R RhandlerR RhandlerR RhandlerR RhandlerR . This doesn’t look right. At all. Why am I just noticing this now? Shouldn’t the payouts be better in M4? Or are these typos. pic.twitter.com/ZyFAPOihPy
2757,Borderlands,Negative,who
2758,Borderlands,Negative,"Borderlands 3 Sucks : Here's Why (UPDATED 2020) youtu.be/oNBoVcEWovQ. . It's sadly true, even though I really likes the gameplay there's some serious problems in to story and drops"
2758,Borderlands,Negative,"Borderlands 3 Sucks: Here's Why (UPDATED 2020) youtu.be / oNBoVcEWovQ.. Unfortunately, it's true, even though I really like the gameplay, there are some serious problems in the story and the crashes"
2758,Borderlands,Negative,Borderlands 3 Sucks: Here's Why (UPDATED 2020) youtu.be / oNBoVcEWovQ.
2758,Borderlands,Negative,"Borderlands 3 Sucks : Here's a (UPDATED 2020) screenshot.be/oNBoVcEWovQ.. It's sadly true, even though I really likes the gameplay ignoring some serious deficiencies in its story and drops"
2758,Borderlands,Negative,"Borderlands at 3 Sucks : Here's Why ( UPDATED in 2020 ) youtu. be / oNBoVcEWovQ.. It'm s sadly not true, even though technically I really likes the gameplay there'z s some truly serious problems fitted in to both story and gameplay drops"
2758,Borderlands,Negative,"Borderlands 3 Sucks : Here's it (UPDATED 2020) By.be/oNBoVcEWovQ.. Actually's sadly true, and though I really likes new gameplay there's 2 serious problems in many story book ending"
2759,Borderlands,Negative,Live-action Borderlands film is just a really long commercial advertisement for the borderlands game.
2759,Borderlands,Negative,The live-action film Borderlands is just a really long commercial advertisement for the Borderlands game.
2759,Borderlands,Negative,Live-action Borderlands film is just a really long commercial advertisement for the borderlands game.
2759,Borderlands,Negative,Live-action Borderlands film is just a really long commercial advertisement for another borderlands game.
2759,Borderlands,Negative,Live - action Borderlands film is just a truly really damn long commercial advertisement for the borderlands superhero game.
2759,Borderlands,Negative,Live-action pirate film is just a really lame commercial advertisement for the borderlands game.
2760,Borderlands,Positive,I had an amazing Borderlands 3 stream with you guys over at twitch.tv/mediocre_at_bst . Thank you!
2760,Borderlands,Positive,I had an incredible Borderlands 3 stream with you on twitch.tv / mediocre _ at _ bst. Thank you!
2760,Borderlands,Positive,I've had an amazing stream of Borderlands 3 with you guys at tch.tv / mediocre _ at _.
2760,Borderlands,Positive,I had an amazing Borderlands 3 stream with you guys over at twitch.tv/mediocre_at_bst . Thank you!
2760,Borderlands,Positive,FM I had an amazing Borderlands 3 stream with you guys over at twitch.tv/mediocre_at_bst . Thank you!
2760,Borderlands,Positive,you
2761,Borderlands,Positive,my second phase of rmo has started again today. i'm about lose my mind so imma restart playing Borderlands 2 -- sementara menanti kedatangan isketambola
2761,Borderlands,Positive,"my second phase of rmo has started again today. I am about to lose my mind, so imma start again to play Borderlands 2 -- sementara menanti kedatangan isketambola"
2761,Borderlands,Positive,my second phase of rmo has started again today. i'm about lose my mind so imma restart playing Borderlands 2 -- sementara menanti kedatangan isketambola
2761,Borderlands,Positive,my second phase of rmo has finished running today. i'm about lose my mind so imma restart playing Borderlands 2 -- sementara menanti kedatangan :)
2761,Borderlands,Positive,my second phase play of rmo has started again sometime today. i'm about completely lose my free mind just so they imma restart playing Borderlands 2 - - sementara na menanti kedatangan da isketambola
2761,Borderlands,Positive,my second phase a rmo show started early today. i'm about lose my mind so imma just playing phase 2 -- sementara 5 kedatangan isketambola
2762,Borderlands,Negative,This is the dumbest thing we've ever made.. @Borderlands @GearboxOfficial @MaxMittelman @2K_ANZ.  
2762,Borderlands,Negative,This is the stupidest thing we've ever done.. @ Borderlands @ GearboxOfficial @ MaxMittelman @ 2K _ ANZ.
2762,Borderlands,Negative,This is the stupidest thing we've ever done.. @ Borderlands @ GearboxOfficial @ Maximan @ 2K _ ANZ.
2762,Borderlands,Negative,This is for dumbest thing anyone ever made.. @Borderlands @GearboxOfficial @MaxMittelman @2K_ANZ.
2762,Borderlands,Negative,33 This is the dumbest ever thing we've really ever thought made.. @Borderlands as @GearboxOfficial @MaxMittelman in @2K_ANZ.
2762,Borderlands,Negative,what is the horrible thing ever've ever made.. by @Borderlands @GearboxOfficial @MaxMittelman.
2763,Borderlands,Negative,Not saying the older games arent flawed. . . Loot was terrible in older updates of BL2.. Terramorphous is a cheap and lazy raid boss compared to Cramulaux in Borderlands 1.
2763,Borderlands,Negative,Not to say that the older games were flawed... loot was terrible in older updates of BL2.. Terramorph is a cheap and lazy boss compared to Cramulaux in Borderlands 1.
2763,Borderlands,Negative,Not to mention that in the old versions of BL2 the lot was awful... Terramorphus is a cheap and lazy raid boss compared to Mulo in Borderlands 1.
2763,Borderlands,Negative,Not saying the older games arent flawed... It was terrible in older updates of BL2.. Terramorphous is a lazy and lazy raid boss compared to stuff in Borderlands 2.
2763,Borderlands,Negative,See Not saying all the older games arent flawed... Captain Loot was made terrible in older production updates of BL2.. Terramorphous is a cheap and lazy raid boss compared to time Cramulaux appeared in Dark Borderlands Vol 1.
2763,Borderlands,Negative,Not saying the older versions arent flawed... Loot was terrible from older updates like BL2.. Terramorphous is really dumb and lazy raid boss compared to Cramulaux in Day 1.
2764,Borderlands,Neutral,Streets of Rage 4! Borderlands 3! Kink shaming...maybe.... what's up? twitch.tv/vosnz
2764,Borderlands,Neutral,Streets of Rage 4! Borderlands 3! Kink shaming... maybe.... what's up? twitch.tv / vosnz
2764,Borderlands,Neutral,Streets of Fury 4! Borderlands 3! Kink shaming... maybe.... what's up?
2764,Borderlands,Neutral,Streets of Rage 4! Borderlands 3! Kink shaming...maybe.... what's up? twitch.tv/vosnz
2764,Borderlands,Neutral,The Streets of Rage 4! Borderlands 3! Kink shaming...maybe.... what's up? twitch.tv/vosnz
2764,Borderlands,Neutral,it
2765,Borderlands,Irrelevant,Portland is feeding and housing the rioters. WTF?
2765,Borderlands,Irrelevant,Portland supplies and houses the rioters. WTF?
2765,Borderlands,Irrelevant,Portland feeds and houses the rioters.
2765,Borderlands,Irrelevant,Portland is feeding and housing the rioters. Really?
2765,Borderlands,Irrelevant,Portland is feeding and maintaining housing off the rioters. WTF?
2765,Borderlands,Irrelevant,Portland is feeding and housing the Seattle. WTF?
2766,Borderlands,Negative,I HATE borderlands 3 Rhys WHY does he look like that this is not the beautiful disaster twink I love
2766,Borderlands,Negative,I hate Borderlands 3 Rhys WHY does he look like this is not the beautiful pacifier I love
2766,Borderlands,Negative,I HATE borderlands 3 Rhys WHY does he look like that this is not the beautiful disaster twink I love
2766,Borderlands,Negative,I HATE borderlands 3 Rhys WHY does he look like that this is not this beautiful disaster that I love
2766,Borderlands,Negative,I HATE borderlands 3 Rhys WHY heck does he almost look up like that this is probably not really the beautiful disaster twink I love
2766,Borderlands,Negative,I HATE borderlands 3 Rhys WHY does this think like that this is not a beautiful disaster twink I love
2767,Borderlands,Positive,Wow
2767,Borderlands,Positive,Wow
2767,Borderlands,Positive,Wow
2767,Borderlands,Positive,Wow
2767,Borderlands,Positive,Dear Wow
2767,Borderlands,Positive,Wow
2768,Borderlands,Neutral,"The Borderlands Ports on Switch are so good, I have no complaints, definitely worth it, can’t wait to get Bioshock Collection next."
2768,Borderlands,Neutral,"The Borderlands Ports on Switch are so good that I have no complaints, it's definitely worth it, I can't wait to get Bioshock Collection next."
2768,Borderlands,Neutral,"Borderlands Pon Swift are so good, I have no complaints, definitely worth it, can't wait for the next Bioshock."
2768,Borderlands,Neutral,"The Borderlands 5 on Switch are so good, I have no complaints, so worth it, can’t wait to get Bioshock Collection 4."
2768,Borderlands,Neutral,"The Borderlands Ports facilities on Castle Switch are so good, though I have no complaints, definitely worth it, and can just ’ t wait to get Bioshock Summer Collection next."
2768,Borderlands,Neutral,"New Borderlands Ports on Switch are so good, 100% gave no complaints, definitely worth it, can’t wait to get Bioshock Collection soon."
2769,Borderlands,Positive,"I FINALLY finished Borderlands 3! It's taken a while, but I'm so proud of myself. :D Now onto the Guns, Love, and Tentacles DLC, I'm so excited! I love Wainwright and Hammerlock so much and they make a great couple, so seeing them get married will be awesome!"
2769,Borderlands,Positive,"It took a while, but I'm so proud of myself.: D Now to the Guns, Love, and Tentacles DLC, I'm so excited! I love Wainwright and Hammerlock so much and they're a great couple, so it'll be great to see them get married!"
2769,Borderlands,Positive,"I finished Borderlands 3! It took a while but I'm so proud of myself.: D Now on Gentacles, Love and Tentacles DLC, I'm so excited! I love Wainwright and so much and they're a great couple, so to see them get married will be amazing!"
2769,Borderlands,Positive,"I FINALLY finished Borderlands 3! It's taken a while, so I'm so proud of myself. With Looking onto the Guns, Weapons, and War DLC, I'm so excited! I love Wainwright and Hammerlock so much because they make a great couple, so seeing them get married will be awesome!"
2769,Borderlands,Positive,"I FINALLY finished Borderlands 3! It's taken a while, but I'm still so proud of myself. : Sam D Now onto download the Guns, Love, and Tentacles DLC, I'm so really excited! I love Wainwright and Hammerlock so much immediately and feel they make a great couple, too so just seeing them get married now will be beyond awesome!"
2769,Borderlands,Positive,"officially FINALLY finished Borderlands 10! It's taken a weekend, so I'm always proud of myself. :D Now onto the Guns, Love, and Tentacles DLC, I'm so excited! I love Wainwright and Hammerlock so hell and they make a great couple, plus seeing them get up will be awesome!"
2770,Borderlands,Positive,Just wanna say The borderlands handsome Jack collection is free for a week on the epic games store and it's to keep so all my PC gamers get that shit
2770,Borderlands,Positive,"I just want to say that the pretty Jack collection is available for free in the Borderlands for a week in the epic gaming shop, and it should be stored in such a way that all my PC players get this shit."
2770,Borderlands,Positive,Just wanna say The borderlands handy Jack collection is free for a week on the epic games store and it's to keep so all my PC gamers get that shit
2770,Borderlands,Positive,Just kidding plug The borderlands handsome Jack collection is free for a week on the epic games store and safe to keep so all my PC gamers get that shit
2770,Borderlands,Positive,Just wanna say It The borderlands handsome Jack White collection is free for a second week on the little epic games betting store corner and it's to keep so all my PC gamers get that shit
2770,Borderlands,Positive,be wanna say this borderlands handsome Jack collection is free about a week through the epic fantasy store and it's to keep so all my PC gamers get that shit
2771,Borderlands,Positive,Omg so much fun with everyone & it's only Day 1!!! @Borderlands  
2771,Borderlands,Positive,Omg so much fun with everyone & it's just day 1!!! @ Borderlands
2771,Borderlands,Positive,Omg so much fun with everyone & it's only Day 1!!! @ Borderlands
2771,Borderlands,Positive,Omg not much fun with everyone & it's only Day 1!!! @Borderlands
2771,Borderlands,Positive,Do Omg with so much fun talking with everyone & it's your only Day 1!!! @Borderlands
2771,Borderlands,Positive,Omg so big fun all everyone & it's only Day 1!!! @Borderlands
2772,Borderlands,Negative,Saw an ad for the new borderlands dlc stuff and i just got sad again knowing fully well bl3 was so horribly mediocre I already miss BL2
2772,Borderlands,Negative,I saw an advertisement for the new Borderlands dlc stuff and got sad again because I knew bl3 was so terribly mediocre that I miss BL2 already
2772,Borderlands,Negative,"Saw an ad for new borderline things and I just got upset again, knowing that totally good bl3 was so horribly mediocre that I already miss BL2"
2772,Borderlands,Negative,Saw an ad on the new borderlands dlc stuff and i just got sad again knowing fully though bl3 was so horribly mediocre I already loved BL2
2772,Borderlands,Negative,Saw ran an ad for the new borderlands dlc s stuff and i just half got sad happy again knowing fully well bl3 was likely so horribly mediocre I might already miss the BL2
2772,Borderlands,Negative,Saw an ad there the new decent dlc stuff and i just got bored again well fully well bl3 was so completely mediocre I already miss BL2
2773,Borderlands,Positive,We're excited to be talking about some of the new things coming to Borderlands 3 during our PAX panel this Saturday!
2773,Borderlands,Positive,We look forward to talking about some of the new things in Borderlands 3 this Saturday during our PAX panel!
2773,Borderlands,Positive,We are pleased to announce some new features that will appear on Borderlands 3 during our PAX panel this Saturday!
2773,Borderlands,Positive,We're excited to be talking about some of the new things coming from Borderlands 3 for our PAX panel this Saturday!
2773,Borderlands,Positive,We'd re excited to be talking about out some of now the new things coming down to Borderlands 3 during after our PAX panel this Saturday!
2773,Borderlands,Positive,We're excited to be talking about some of the best things coming to Borderlands 3 and our PAX panel last Saturday!
2775,Borderlands,Negative,@Borderlands I can't Link my shift to my twitch account just wondering if you could look into that please
2775,Borderlands,Negative,@ Borderlands I can't link my shift to my Twitch account and just wonder if you could check it out please
2775,Borderlands,Negative,"@ Borderlands I can't link my transition to my account, just wondering if you could look into it please"
2775,Borderlands,Negative,@Borderlands I can't Link my shift to this twitch account just wondering if you could look into changing please
2775,Borderlands,Negative,Agent @Borderlands I can't get Link in my shift to my private twitch account just wondering if you could look into that please
2775,Borderlands,Negative,@Borderlands I can't make my shift to my Account account just wondering if you could look like that please
2776,Borderlands,Positive,finished borderlands 2 wtf do i now pic.twitter.com/jfJafNvazj
2776,Borderlands,Positive,2 wtf do i now pic.twitter.com / jfJafNvazj
2776,Borderlands,Positive,finished 2 wtf do i now pic.freedom.com / JafNvazj
2776,Borderlands,Positive,finished borderlands 2 wtf do i now pic.twitter.com/jfJafNvazj
2776,Borderlands,Positive,to finished borderlands 2 wtf do i now pic.twitter.com/jfJafNvazj
2776,Borderlands,Positive,to
2777,Borderlands,Neutral,borderlands 2 is free on epic now why do i keep getting scammed
2777,Borderlands,Neutral,"borderlands 2 is on epic now for free, why do I get cheated again and again"
2777,Borderlands,Neutral,borderlands 2 is free on epic now why do i keep getting screen?
2777,Borderlands,Neutral,borderlands 2 is free of epic now why do i keep getting scammed
2777,Borderlands,Neutral,borderlands 2 is free working on this epic so now why do i keep getting scammed
2777,Borderlands,Neutral,borderlands 2 is free on epic island why do i keep gets scammed
2778,Borderlands,Negative,"@2ksupport @Borderlands. Is there a fix for borderlands 3 crashing and turning my Xbox one X off? Can’t be healthy for the console. It’s happened 4 times in a row, try to launch the game and it’s crashes and lowers down."
2778,Borderlands,Negative,"@ 2ksupport @ Borderlands. Is there a solution to crashing Borderlands 3 and turning off my Xbox One X? Can't be healthy for the console. It's happened four times in a row, try to start the game and it crashes and sinks."
2778,Borderlands,Negative,"@ 2ksupport @ Borderlands. Is there a fix for borderlands 3 crashing and turning my Xbox one X off? Can't be healthy for the console. It's happened 4 times in a row, try to launch the game and it's crashes and lows down."
2778,Borderlands,Negative,"@2ksupport @Borderlands. Is there a reason for borderlands 3 crashing and turning my Xbox one X off? Would be mean for the console. It’s happened 4 times of each row, try to launch the game but it’s crashes and lowers down."
2778,Borderlands,Negative,"@2ksupport @Borderlands. Is there a fix for borderlands Episode 3 crashing and turning my Xbox Xbox with one X off? 7 Can ’ the t be more healthy for crashing the console. 1 It ’ s happened 4 times in a row, try to stay launch the game and ignore it ’ s crashes and lowers down."
2778,Borderlands,Negative,"@2ksupport @Borderlands. Is there a reason for borderlands 2 crashing while turning my Xbox one or off? Can’t be healthy for the review. It’s tested 4 times in a week, try to launch this game but it’s crashes and lowers down."
2779,Borderlands,Positive,disturbing.. . i was looking forward to borderlands joining bt and the booksmith on haight.
2779,Borderlands,Positive,Disturbing... I was looking forward to the border countries coming to haight and the bookseller coming to haight.
2779,Borderlands,Positive,I was looking forward to being joined by the Border Force and the Boots on the oval.
2779,Borderlands,Positive,disturbing... i was first set to borderlands joining bt and the booksmith on haight.
2779,Borderlands,Positive,Absolutely disturbing... i was looking forward to borderlands people joining bt the and had the booksmith on haight.
2779,Borderlands,Positive,<unk>... i was looking forward to borderlands from bt and the booksmith on this.
2780,Borderlands,Negative,This is why I did not buy borderlands 3. Randy Pitchford is  fucking scum.
2780,Borderlands,Negative,That's why I didn't buy Borderlands 3. Randy Pitchford is damn scum.
2780,Borderlands,Negative,That's why I didn't buy Borders 3. Randy Pitchford is a fucking scum.
2780,Borderlands,Negative,This is why I did not buy borderlands ammo. Randy Pitchford is  fucking awesome.
2780,Borderlands,Negative,This is certainly why I did me not buy borderlands 3. 2 Randy Pitchford is a fucking scum.
2780,Borderlands,Negative,This are why I could not buy borderlands movies. Randy Pitchford is fucking scum.
2781,Borderlands,Neutral,@Borderlands  handsome collection free on epic game store please do it for the switch . 
2781,Borderlands,Neutral,@ Borderlands beautiful collection free to save epic game please do it for the switch.
2781,Borderlands,Neutral,"@ Borderlands beautiful collection for free on epic games store, please do it for the switch."
2781,Borderlands,Neutral,@Borderlands  handsome collection free on epic game store please get it for the switch.
2781,Borderlands,Neutral,Any @Borderlands for handsome collection free on epic game store please only do it for the switch.
2781,Borderlands,Neutral,@Borderlands handsome quality free on mobile game store please do it for the switch.
2782,Borderlands,Positive,"Wow, Borderlands the presequeal was 2014 and I still haven't played it"
2782,Borderlands,Positive,"Wow, Borderlands was 2014 and I still haven't played it"
2782,Borderlands,Positive,"Wow, Borderlands the preequeal was 2014 and I still haven't played it"
2782,Borderlands,Positive,"Wow, Borderlands the Dead was 2014 and I still haven't played it"
2782,Borderlands,Positive,"Wow, Borderlands in the band presequeal was 2014 and I still technically haven't played it"
2782,Borderlands,Positive,"Wow, totally the presequeal was 2014 yet I still haven't played that"
2783,Borderlands,Positive,"Super fun game, would highly HIGHLY recommend it. And it’s literally free right now, so what reason do you have to not try it? Of course, I’d recommend playing the others Borderlands games before this one for story purposes, but it won’t be free forever so go get it anyway."
2783,Borderlands,Positive,"And it's literally free at the moment, so what reason do you have not to try it? Of course I would recommend to play the other Borderlands games before this game for storytelling purposes, but it won't be free forever, so get it anyway."
2783,Borderlands,Positive,"Super fun game, would highly recommend it. And it's literally free right now, so what do you have to not try it? Of course, I'd recommend the others Borderlands games before this one for story purposes, but it won't be free forever, so go get it anyway."
2783,Borderlands,Positive,"Super fun games, would highly HIGHLY recommend it. But it’s literally free right now, so what reason do ya have to no try it? Of course, I’d recommend playing the others Borderlands games before either one for story purposes, but it won’t be free forever so go get it now."
2783,Borderlands,Positive,"Super fun game, would highly HIGHLY recommend putting it. And it ’ s literally free right now, so what reason do you all have to not really try it? Of course, and I ’ d recommend you playing the near others in Borderlands games long before this one for story purposes, but it won ’ t likely be free forever so go get it going anyway."
2783,Borderlands,Positive,"Super fun game, would highly HIGHLY recommend it. And is literally free right now, so what reason can others have to not try it? Not course, I’d recommend playing the others Borderlands games before my one for story purposes, and these won’t be free forever so go try mine anyway."
2784,Borderlands,Neutral,>> Timothy Lawrence . >> So pure of heart. So dumb of ass. . . [  
2784,Borderlands,Neutral,> > Timothy Lawrence. > > So pure of heart. So stupid from the ass... [
2784,Borderlands,Neutral,> > Your Lawrence. > > So pure in heart.
2784,Borderlands,Neutral,>> Timothy ]. >> So pure of heart. So dumb of ass... [
2784,Borderlands,Neutral,> > To Timothy Lawrence. > > So pure of heart. to So totally dumb of an ass... [
2784,Borderlands,Neutral,>> Timothy Jones. >> So small of heart. How dumb of ass... [
2785,Borderlands,Negative,For more then 3 weeks now 2k uk hasnt drawn a winner for their borderlands 3 collector edition giveaway. I mean I think thats funny that companies can just do fake giveaways and not be called out on it. youtube.com/watch?v=-HUh50…
2785,Borderlands,Negative,"For more than 3 weeks, 2k uk has not drawn a winner for its Borderlands 3 Collector Edition sweepstakes. I mean, I think it's funny that companies can just make fake freebies and not be viewed. youtube.com / watch? v = -HUh50..."
2785,Borderlands,Negative,"I mean, it's ridiculous that companies can just make fake gifts and not be called out on it. youtube.com / watch? v = -HUh50..."
2785,Borderlands,Negative,For more then 3 weeks now 2k uk hasnt posted a winner for their borderlands 3 collector edition giveaway. I mean I think thats silly that companies may just do fake giveaways and not be shut out on racism. youtube.com/watch?v=-HUh50…
2785,Borderlands,Negative,For more then 3 weeks now 2k uk still hasnt drawn a winner for buying their borderlands 3 collector kit edition false giveaway. I mean I think well thats funny that companies can just so do fake giveaways and not have be called out on it. at youtube. com / watch? baby v = - HUh50 0 …
2785,Borderlands,Negative,For more then 3 weeks over 2k uk been drawn a winner for their borderlands 3 collector gift review. I thought I think thats funny which companies can really do fake giveaways and not be called out doing it. review.com/watch?v=-HUh50...
2787,Borderlands,Neutral,"I promised a purple version before the weekend,  but then spent 3 days playing borderlands 2 with the wife... also have to learn more about the URP in Unity currently my lights don't render properly. Note to self… instagram.com/p/CDbhq7WlNt_/…"
